{
  "copy_id": "copy_7b2e1a4c",
  "decision": "ACCEPT",
  "reason_codes": [
    "PASS"
  ],
  "metrics": {
    "schema_ok": true,
    "missing_rate_by_field": {
      "id": 0.0,
      "label": 0.0,
      "content": 0.2
    },
    "duplicates_rate": 0.0,
    "range_violations_count_by_field": {
      "score": 0
    },
    "enum_violations_count_by_field": {
      "category": 0
    },
    "postcheck_ok": true,
    "patterns_remaining_count": 0
  },
  "transform_summary": {
    "pii_redacted_count": 5,
    "whitespace_normalized": true,
    "encoding_fixed": true,
    "html_tags_removed": 12
  },
  "timestamp": "2026-01-25T17:38:00Z"
}